{
  "policy_version": 1,
  "id": "source-reconcile-release-gate",
  "title": "Source Reconcile Release Gate",
  "description": "A strict release-oriented source-reconcile gate that only passes fully verified or no-op workflows and fails on blocked execution or any verification drift.",
  "defaults": {
    "allowed_states": [
      "verified",
      "no_reconcile_actions"
    ],
    "require_report_complete": true,
    "fail_on_blocked_execution": true,
    "fail_on_pending_verification": true,
    "fail_on_blocked_verification": true,
    "fail_on_verification_drift": true
  }
}
